<?xml version="1.0" encoding="utf-8"?>
<library xmlns="http://example.org/mca/library"
         xmlns:xsi="http://www.w3.org/2001/XMLSchema-instance"
         xsi:schemaLocation="http://example.org/mca/library library.xsd">
  <books>
    <book>
      <title>book1</title>
      <year>1945</year>
      <lang>EN</lang>
      <authors>
		    <author ref="1"/>
	    </authors>
    </book>
  
    <book>
      <title>book2</title>
      <year>1942</year>
      <lang>PL</lang>
	    <authors>
	   	  <author ref="1"/>
		    <author ref="2"/>
	    </authors>
    </book>
  
    <book>
      <title>book3</title>
      <year>1992</year>
      <lang>EN</lang>
      <authors>
		    <author ref="3"/>
		    <author ref="4"/>
	    </authors>
    </book>
  </books>

  <authors>
    <author id="1">
      <names>
        <name>author1name1</name>
      </names>
      <surname>author1surname</surname>
    </author>
    <author id="2">
      <names>
        <name>author2name1</name>
        <name>author2name2</name>
      </names>
      <surname>author2surname</surname>
    </author>
    <author id="3">
      <names>
        <name>author3name1</name>
        <name>author3name2</name>
      </names>
      <surname>author3surname</surname>
    </author>
    <author id="4">
      <names>
        <name>author4name1</name>
        <name>author4name2</name>
      </names>
      <surname>author4surname</surname>
    </author>
    <author id="5">  <!--This author is not used in the library-->
      <names>
        <name>author5name1</name>
        <name>author5name2</name>
      </names>
      <surname>author5surname</surname>
    </author>
  </authors>
  
</library>